{
  "$schema": "http://json-schema.org/draft-07/schema#",
  "title": "Documento procesado - Sistema de Conocimiento Académico",
  "description": "Esquema mínimo para cada unidad de contenido (artículo, sección, apunte) antes de chunking/embeddings.",
  "type": "object",
  "required": ["id", "fuente", "tipo", "titulo", "texto", "url_origen", "fecha_scrapeo", "vigente"],
  "properties": {
    "id": {
      "type": "string",
      "description": "Identificador único y legible. Convención sugerida: {tipo}_{titulo_slug}_art_{n}",
      "examples": ["constitucion_1967_art_7", "codigo_civil_art_1245"]
    },
    "fuente": {
      "type": "string",
      "description": "Origen del documento.",
      "examples": ["IMPO", "apunte_personal", "ANEP", "bibliografia"]
    },
    "tipo": {
      "type": "string",
      "enum": ["constitucion", "codigo", "ley", "decreto", "apunte", "bibliografia", "jurisprudencia"]
    },
    "titulo": {
      "type": "string",
      "description": "Nombre completo de la norma o fuente.",
      "examples": ["Constitución de la República", "Código Civil"]
    },
    "articulo": {
      "type": ["string", "null"],
      "description": "Número de artículo o sección, si aplica. Null para fuentes sin estructura articulada (ej. apuntes)."
    },
    "inciso": {
      "type": ["string", "null"],
      "description": "Sub-unidad dentro del artículo, para artículos largos que requieren sub-chunking."
    },
    "materia": {
      "type": ["string", "null"],
      "description": "Etiqueta de materia/curso, útil para filtrar en Fase 4 (ej. 'Derecho Civil I')."
    },
    "texto": {
      "type": "string",
      "description": "Contenido textual limpio del chunk."
    },
    "url_origen": {
      "type": "string",
      "format": "uri",
      "description": "URL de la ficha original en IMPO u otra fuente."
    },
    "fecha_scrapeo": {
      "type": "string",
      "format": "date",
      "description": "Fecha en que se extrajo el contenido (YYYY-MM-DD)."
    },
    "vigente": {
      "type": "boolean",
      "description": "Si la norma está vigente al momento del scrapeo. Relevante para IMPO 'texto actualizado y concordado'."
    },
    "hash_contenido": {
      "type": ["string", "null"],
      "description": "Hash del texto (ej. sha256), usado en Fase 5 para detectar cambios sin reprocesar todo."
    },
    "seccion_capitulo": {
      "type": ["string", "null"],
      "description": "Encabezado de sección/capítulo vigente al momento del artículo (ej. 'SECCION I - DE LA NACION Y SU SOBERANIA CAPITULO I'). Útil para citar y para dar contexto, opcional."
    },
    "notas": {
      "type": ["string", "null"],
      "description": "Notas oficiales de IMPO sobre el artículo (referencias cruzadas, reformas, reglamentación). Separadas del texto normativo."
    }
  }
}