{
  "id": "constitucion_1967_art_1",
  "fuente": "IMPO",
  "tipo": "constitucion",
  "titulo": "Constitución de la República",
  "articulo": "1",
  "inciso": null,
  "materia": null,
  "texto": "La República Oriental del Uruguay es la asociación política de todos los habitantes comprendidos dentro de su territorio.",
  "url_origen": "https://www.impo.com.uy/bases/constitucion/1967-1967/1",
  "fecha_scrapeo": "2026-08-24",
  "vigente": true,
  "hash_contenido": null
}
